{
  "schemaVersion": 1,
  "id": "odaiba6",
  "name": { "zh": "原作六位", "ja": "原作の六位置" },
  "description": {
    "zh": "《物語の体操》第一讲图 4 的六个位置，顺序与含义照录原文：3 → 1 → 2 → 6 为时间线，4 在上为助力，5 在下为阻力。抽到的牌按抽出顺序落到编号位置，不因牌面而重排。",
    "ja": "『物語の体操』第一講・図4の六つの位置。順序と意味は原文どおり：3→1→2→6 が時間軸、4 が上（助力）、5 が下（抵抗）。引いた札は引いた順に番号位置へ置かれ、札面によって並べ替えてはならない。"
  },
  "slots": [
    {
      "id": "slot1",
      "order": 1,
      "label": { "zh": "主角的现在", "ja": "主人公の現在" },
      "meaning": {
        "zh": "故事此刻的主人公：他站在哪里、被什么事缠住、手上有什么。",
        "ja": "物語の現在地点の主人公。どこに立ち、何に絡め取られ、何を手にしているか。"
      },
      "x": 1,
      "y": 1,
      "question": {
        "zh": "此刻的主人公，最放不下的一件事是什么？",
        "ja": "いまこの瞬間、主人公が最も手放せない一件は何か。"
      }
    },
    {
      "id": "slot2",
      "order": 2,
      "label": { "zh": "主角的近未来", "ja": "主人公の近い未来" },
      "meaning": {
        "zh": "紧接着现在会发生的事：主人公即将撞上的下一个局面。",
        "ja": "現在のすぐ後に起こること。主人公が次にぶつかる局面。"
      },
      "x": 2,
      "y": 1,
      "question": {
        "zh": "接下来最可能发生的那件事，会把主人公推向哪里？",
        "ja": "次に起こりうる出来事は、主人公をどこへ押し出すか。"
      }
    },
    {
      "id": "slot3",
      "order": 3,
      "label": { "zh": "主角的过去", "ja": "主人公の過去" },
      "meaning": {
        "zh": "时间线的起点：主人公带着什么样的来历走到现在。",
        "ja": "時間軸の起点。主人公がどんな来歴を背負って現在に至ったか。"
      },
      "x": 0,
      "y": 1,
      "question": {
        "zh": "什么样的过去，让主人公非成为现在这个人不可？",
        "ja": "どんな過去が、主人公を現在のこの人物にしたのか。"
      }
    },
    {
      "id": "slot4",
      "order": 4,
      "label": { "zh": "援助者", "ja": "援助者" },
      "meaning": {
        "zh": "位于上方的助力：伸出手的人、可依靠的物件、或主人公自己的一份底气。",
        "ja": "上に置かれた助力。手を差し伸べる者、頼れる物、あるいは主人公自身の底力。"
      },
      "x": 1,
      "y": 0,
      "question": {
        "zh": "谁（或什么）愿意帮主人公，而主人公敢不敢接受？",
        "ja": "誰（あるいは何）が主人公を助けようとしているか。主人公はそれを受け取れるか。"
      }
    },
    {
      "id": "slot5",
      "order": 5,
      "label": { "zh": "敌对者", "ja": "敵対者" },
      "meaning": {
        "zh": "位于下方的阻力：挡路的人、制度的重量、或主人公心里的那根刺。",
        "ja": "下に置かれた抵抗。立ちはだかる者、制度の重さ、あるいは主人公の内なる棘。"
      },
      "x": 1,
      "y": 2,
      "question": {
        "zh": "挡住主人公的，是外面的人，还是他自己的一部分？",
        "ja": "主人公を阻むのは外の誰かか、それとも彼自身の一部か。"
      }
    },
    {
      "id": "slot6",
      "order": 6,
      "label": { "zh": "结局（目的）", "ja": "結末（目的）" },
      "meaning": {
        "zh": "时间线的终点，也是主人公真正想到达的目的地。",
        "ja": "時間軸の終点であり、主人公が本当に到達したい目的。"
      },
      "x": 3,
      "y": 1,
      "question": {
        "zh": "走到最后，主人公得到的和最初想要的，是同一个东西吗？",
        "ja": "最後に主人公が得るものと、最初に望んだものは同じか。"
      }
    }
  ]
}
